{
  "$schema": "http://json-schema.org/draft-07/schema#",
  "$id": "https://github.com/johnstel/azureeslzmultisubdemo/identity/schema/pim-activation-policy.schema.json",
  "title": "Entra PIM role-activation policy input (demo artifact)",
  "description": "Declarative shape for a Microsoft Graph unifiedRoleManagementPolicy assignment/notification rule set for Privileged Identity Management. This file is validated statically and is never sent to Microsoft Graph by this repository.",
  "type": "object",
  "required": [
    "roleName",
    "assignmentType",
    "activation",
    "notifications",
    "emergencyAccessExclusion",
    "notes"
  ],
  "additionalProperties": false,
  "properties": {
    "roleName": {
      "type": "string",
      "minLength": 1
    },
    "assignmentType": {
      "type": "string",
      "description": "Access must be eligible, never permanent, for every role governed by this artifact.",
      "const": "eligible"
    },
    "activation": {
      "type": "object",
      "required": [
        "requireApproval",
        "approvers",
        "requireMultiFactorAuthentication",
        "authenticationContext",
        "requireJustification",
        "maximumActivationDurationHours"
      ],
      "additionalProperties": false,
      "properties": {
        "requireApproval": {
          "type": "boolean",
          "const": true
        },
        "approvers": {
          "type": "array",
          "minItems": 1,
          "items": {
            "type": "string",
            "pattern": "^(REPLACE_WITH_.+|[0-9a-fA-F]{8}-[0-9a-fA-F]{4}-[0-9a-fA-F]{4}-[0-9a-fA-F]{4}-[0-9a-fA-F]{12})$"
          },
          "description": "Object ID(s) of the PIM approver group/user. In the committed template this must remain a REPLACE_WITH_* placeholder; a locally populated (never committed) copy replaces it with a real group/user object ID before any apply workflow runs. See scripts/validate-identity-artifacts.sh --mode."
        },
        "requireMultiFactorAuthentication": {
          "type": "boolean",
          "const": true
        },
        "authenticationContext": {
          "type": "string",
          "pattern": "^c([1-9]|1[0-9]|2[0-5])$",
          "description": "Microsoft Graph authenticationContextClassReference id ('c1'..'c25') required at activation. This is a fixed, tenant-independent Graph claim value, not a tenant-specific placeholder; it must match the id used by the corresponding report-only Conditional Access policy's conditions.applications.includeAuthenticationContextClassReferences (see identity/conditional-access and identity/schema/known-entra-ids.json) so the two artifact types stay coherent."
        },
        "requireJustification": {
          "type": "boolean",
          "const": true
        },
        "maximumActivationDurationHours": {
          "type": "integer",
          "minimum": 1,
          "maximum": 8
        }
      }
    },
    "notifications": {
      "type": "object",
      "required": ["notifyAdminsOnActivation", "notifyApproversOnActivationRequest", "notifyAssigneeOnActivation"],
      "additionalProperties": false,
      "properties": {
        "notifyAdminsOnActivation": { "type": "boolean", "const": true },
        "notifyApproversOnActivationRequest": { "type": "boolean", "const": true },
        "notifyAssigneeOnActivation": { "type": "boolean", "const": true }
      }
    },
    "emergencyAccessExclusion": {
      "type": "object",
      "required": ["required", "placeholder", "description"],
      "additionalProperties": false,
      "properties": {
        "required": {
          "type": "boolean",
          "const": true
        },
        "placeholder": {
          "type": "string",
          "pattern": "^(REPLACE_WITH_.+|[0-9a-fA-F]{8}-[0-9a-fA-F]{4}-[0-9a-fA-F]{4}-[0-9a-fA-F]{4}-[0-9a-fA-F]{12})$",
          "description": "Object ID of the emergency-access/break-glass account that must remain permanently assigned outside this eligible/approval workflow. In the committed template this must remain a REPLACE_WITH_* placeholder; a locally populated (never committed) copy replaces it with a real account object ID before any apply workflow runs. See scripts/validate-identity-artifacts.sh --mode."
        },
        "description": {
          "type": "string",
          "minLength": 1
        }
      }
    },
    "notes": {
      "type": "string",
      "minLength": 1
    }
  }
}
